<!ELEMENT empleados (empleado*)>
<!ELEMENT empleado (nombre)>
<!ATTLIST empleado codigo ID #REQUIRED>
<!ATTLIST empleado jefe IDREF "e0001">
<!ELEMENT nombre (#PCDATA)>